{
  "request_id": "FR-17572141041457486",
  "title": "Implement Feature Management (FR-001)",
  "description": "Implement the feature request management system as specified in requirement FR-001",
  "priority": "high",
  "requester": "development_team",
  "status": "approved",
  "created_at": "2025-09-06T22:01:44.145219",
  "updated_at": "2025-09-06T22:01:44.151174",
  "approved_by": "product_owner",
  "rejection_reason": "Aligns with requirement FR-001 from version 1757214104136"
}