{
  "request_id": "FR-17572144665708203",
  "title": "Enhanced User Profile Management",
  "description": "Users should be able to manage their profiles with advanced customization options including avatar upload, bio, and preferences",
  "priority": "medium",
  "requester": "product_team",
  "status": "rejected",
  "created_at": "2025-09-06T22:07:46.570168",
  "updated_at": "2025-09-06T22:07:46.576175",
  "approved_by": "test_admin",
  "rejection_reason": "Does not align with current priorities"
}