{
  "request_id": "FR-17572144665237308",
  "title": "Enhanced User Profile Management",
  "description": "Users should be able to manage their profiles with advanced customization options including avatar upload, bio, and preferences",
  "priority": "medium",
  "requester": "product_team",
  "status": "approved",
  "created_at": "2025-09-06T22:07:46.523672",
  "updated_at": "2025-09-06T22:07:46.529650",
  "approved_by": "test_admin",
  "rejection_reason": "Good idea"
}